	aspect term	text
0	;cord;battery life	I charge it at night and skip taking the cord with me because of the good battery life.
1	";service center;""sales"" team;tech guy"	"The tech guy then said the service center does not do 1-to-1 exchange and I have to direct my concern to the ""sales"" team, which is the retail shop which I bought my netbook from."
2	;quality;gui;applications;use	it is of high quality, has a killer GUI, is extremely stable, is highly expandable, is bundled with lots of very good applications, is easy to use, and is absolutely gorgeous.
3	;start up	Easy to start up and does not overheat as much as other laptops.
4	;features;ichat;photobooth;garage band	I even got my teenage son one, because of the features that it offers, like, iChat, Photobooth, garage band and more!
5	;features	Great laptop that offers many great features!
6	;gui;screen;power light;hard drive ligh	 One night I turned the freaking thing off after using it, the next day I turn it on, no GUI, screen all dark, power light steady, hard drive light steady and not flashing as it usually does.
7	;processor;graphics cards;battery life	"My only disappointment with the 13"" model is that they're the only ones in the MacBook Pro line up without an i5 or i7 processor and dual graphics cards, however the trade-off is that you achieve a longer battery life (of about 2 more hours)."
8	;battery	I took it back for an Asus and same thing- blue screen which required me to remove the battery to reset.
9	;rubber enclosure;edge	In the shop, these MacBooks are encased in a soft rubber enclosure - so you will never know about the razor edge until you buy it, get it home, break the seal and use it (very clever con).
10	;multi-touch gestures;tracking area;external mouse;gaming	However, the multi-touch gestures and large tracking area make having an external mouse unnecessary (unless you're gaming).
11	;suite of software	I love the way the entire suite of software works together.
12	;speed	The speed is incredible and I am more than satisfied.
13	;windows 7	This laptop meets every expectation and Windows 7 is great!
14	;usb devices	I can barely use any usb devices because they will not stay connected properly.
15	;keyboard	-No backlit keyboard, but not an issue for me.
16	;software;system	When I finally had everything running with all my software installed I plugged in my droid to recharge and the system crashed.
17	;microsoft office for the mac	One suggestion I do have, is to not bother getting Microsoft office for the mac expecting it will work just like you knew it to on a PC.
18	;syncing	Pairing it with an iPhone is a pure pleasure - talk about painless syncing - used to take me forever - now it's a snap.
19	";30"" hd monitor;screen"	"I also got the added bonus of a 30"" HD Monitor, which really helps to extend my screen and keep my eyes fresh!"
20	;boot up	The machine is slow to boot up and occasionally crashes completely.
21	;service	After paying several hundred dollars for this service, it is frustrating that you cannot get help after hours.
22	;battery	I did have to replace the battery once, but that was only a couple months ago and it's been working perfect ever since.
23	;operating system;preloaded software	I love the operating system and the preloaded software.
24	;price;features	The best thing about this laptop is the price along with some of the newer features.
25	;clock in bios setup	After numerous attempts of trying (including setting the clock in BIOS setup directly), I gave up(I am a techie).
26	;warranty service	YOU WILL NOT BE ABLE TO TALK TO AN AMERICAN WARRANTY SERVICE IS OUT OF COUNTRY.
27	;brand	but now i have realized its a problem with this brand.
28	;warranty	I sent it back to Toshiba twice they covered it under the  warranty.
29	;features	I was looking for a mac which is portable and has all the features that I was looking for.
30	;fan	Also kinda loud when the fan was running.
31	;customer service number;warranty;talking to a technician	"In desparation, I called their Customer Service number and was told that my warranty had expired (2 days old) and that the priviledge of talking to a technician would cost me (""have your credit card ready"")."
32	;hard disc;windows;drivers	There also seemed to be a problem with the hard disc as certain times windows loads but claims to not be able to find any drivers or files.
33	;drivers;bios update;system	Drivers updated ok but the BIOS update froze the system up and the computer shut down.
34	;hp technical support	Spent 2 hours on phone with HP Technical Support.
35	;browser	Speaking of the browser, it too has problems.
36	;keyboard	The keyboard is too slick.
37	;virus scan	Nightly my computer defrags itself and runs a virus scan.
38	;9 punds	It's like 9 punds, but if you can look past it, it's GREAT!
39	;program	It's just as fast with one program open as it is with sixteen open.
40	;warrenty	Still under warrenty so called Toshiba, no help at all.
41	;toshiba warranty	I was happy with My purchase of a Toshiba Satellite L305D-S5934 laptop until it came time to have it repaired under the Toshiba Warranty.
42	;quality	Amazing Quality!
43	;webcam;value	The fact that you can spend over $100 on just a webcam underscores the value of this machine.
44	;internet;managing personal files	I mainly use it for email, internet, and managing personal files (pics, vids, etc.).
45	;motherboard	A month or so ago, the freaking motherboard just died.
46	;system	The system it comes with does not work properly, so when trying to fix the problems with it it started not working at all.
47	;charger;hardware	Then after 4 or so months the charger stopped working so I was forced to go out and buy new hardware just to keep this computer running.
48	;force quit	If a website ever freezes (which is rare), its really easy to force quit.
49	;works	It rarely works and when it does it's incredibly slow.
50	;windows 7;vmware program	I also enjoy the fact that my MacBook Pro laptop allows me to run Windows 7 on it by using the VMWare program.
51	;operating system;runs;navigate;find files	It's so much easier to navigate through the operating system, to find files, and it runs a lot faster!
52	;warrenty	Purchased a Toshiba Lap top it worked good until just after the warrenty went out.
53	;extended warranty	I wanted to purchase the extended warranty and they refused, because they knew it was trouble.
54	;memory;speed;performace	We upgraded the memory to four gigabytes in order to take advantage of the performace increase in speed.
55	;opening my documents folder	The reality was, it heated up very quickly, and took way too long to do simple things, like opening my Documents folder.
56	;operating systems	I had always used PCs and been constantly frustrated by the crashing and the poorly designed operating systems that were never very intuitive.
57	;charger	Then, within 5 months, the charger crapped out on me.
58	;speed	And if you have a iphone or ipod touch you can connect and download songs to it at high speed.
59	;glass touchpad	I love the glass touchpad.
60	;hard drive;mother board	  I continued to take the computer in AGAIN and they replaced the hard drive and mother board yet again.
61	;external speaker;sound	I am using the external speaker- sound is good.
62	;battery life	still testing the battery life as i thought it would be better, but am very happy with the upgrade.
63	;hardware	Then HP sends it back to me with the hardware screwed up, not able to connect.
64	;shipping	Oh yeah, don't forget the expensive shipping to and from HP.
65	;mac software;microsoft software;use	Everything is so easy to use, Mac software is just so much simpler than Microsoft software.
66	;delete  key;editing	And if you do a lot of writing, editing is a problem since there is no  forward delete  key.
67	;use;service;phone assistance;genius bar	Its ease of use and the top service from Apple- be it their phone assistance or bellying up to the genius bar- cannot be beat.
68	;battery life;battery life;gaming;movie playing;web browsing;word editing	It has a 10 hour battery life when you're doing web browsing and word editing, making it perfect for the classroom or office, and in terms of gaming and movie playing it'll have a battery life of just over 5 hours.
69	;recovery discs	Acer has set me up with FREE recovery discs, when they are available since I asked.
70	";office max's ""max assurance"""	"I also purchased Office Max's ""Max Assurance"" with the ""no lemon"" clause."
71	;imac backup disc;usb	I eventually did the migration from my iMac backup disc which uses USB.
72	;battery life	The battery life seems to be very good, and have had no issues with it.
73	;battery timer	Enabling the battery timer is useless.
74	;temperatures;core processing unit temperatures	Temperatures on the outside were alright but i did not track in Core Processing Unit temperatures.
75	;service	Going to bring it to service today.
76	;virus protection for mac	There is no need to purchase virus protection for Mac, which saves me a lot of time and money.
77	;bluetooth	But we had paid for bluetooth, and there was none.
78	;lg notebook service center;hinge	So, I paid a visit to LG notebook service center at Alexandra Road, hoping they can make the hinge tighter.
79	;games	My daughter uses it for games, email, facebook, pictures and music.
80	;responds	It is always reliable, never bugged and responds well.
81	;motherboard;motherboard	After about a week I finally got it back and was told that the motherboard had failed and so they installed a new motherboard.
82	;hardware	It was slow, locked up, and also had hardware replaced after only 2 months!
83	;motherboard	they had to replace the motherboard in April
84	;use	Yes, the computer was light weight, less expensive than the average laptop, and was pretty self explantory in use.
85	;representive at microsoft;system;xp	Also, if you need to talk to a representive at Microsoft, there is a charge, which I believe is robbery, since you are charged enormous amounts for a very badly designed system, which most people would have went with XP if they could.
86	;windows 7;vista	I love WIndows 7 which is a vast improvment over Vista.
87	;keyboard	Keyboard is great, very quiet for all the typing that I do.
88	;dell's customer disservice	Dell's customer disservice is an insult to it's customers who pay good money for shoddy products.
89	;cooling system;use	It had a cooling system malfunction after 10 minutes of general use, and would not move past this error.
90	;quad core i7	I can render AVCHD movies with little effort, which was a problem for most pc's unless you had a quad core I7.
91	;sales associate	After talking it over with the very knowledgeable sales associate, I chose the MacBook Pro over the white MacBook.
92	;system;windows applications	If you really want a bang-up system and don't need to run Windows applications, go with an Apple;
93	;virus program	You won't have to spend gobs of money on some inefficient virus program that needs to be updated every month and that constantly drains your wallet.
94	;weighed;seven pounds	It weighed like seven pounds or something like that.
95	;battery	2 months later, the battery went.
96	;bag	You may need to special order a bag.
97	;color	It's color is even cool.
98	;keys;designed	keys are all in weird places and is way too large for the way it is designed.
99	;style;speed	Yes, a Mac is much more money than the average laptop out there, but there is no comparison in style, speed and just cool factor.
100	;keyboard	The keyboard feels good and I type just fine on it.
101	;mousepad	I thought the white Mac computers looked dirty too quicly where you use the mousepad and where you place your hands when typing.
102	;battery	And not to mention after using it for a few months or so, the battery will slowly less and less hold a charge until you can't leave it unplugged for more than 5 minutes without the thing dying.
103	;sales;service;dell support	BEST BUY - 5 STARS + + + (sales, service, respect for old men who aren't familiar with the technology) DELL COMPUTERS - 3 stars DELL SUPPORT - owes a me a couple
104	;hard drive;motherboard	no complaints with their desktop, and maybe because it just sits on your desktop, and you don't carry it around, which could jar the hard drive, or the motherboard.
105	;speed;construction quality;longevity;cost	Yes, they cost more, but they more than make up for it in speed, construction quality, and longevity.
106	";keyboard;keys;configuration of ""extra key"""	"Since I keyboard over 100 wpm, I look for a unit that has a comfortble keyboard (no keys sticking or lagging, strange configuration of ""extra key"", etc."
107	;touch pad	) I also tried the touch pad and compared it to other netbooks in the store.
108	;use;security;pricetag	It absolutely is more expensive than most PC laptops, but the ease of use, security, and minimal problems that have arisen make it well worth the pricetag.
109	;use;work	  It gets stuck all of the time you use it, and you have to keep tapping on it to get it to work.
110	;preloaded software	lots of preloaded software.
111	;webcam	I wish it had a webcam though, then it would be perfect!
112	;vga port;screen	My favorite part of this computer is that it has a vga port so I can connect it to a bigger screen.
113	;battery life	Another thing I might add is the battery life is excellent.
114	;keys	One drawback, I wish the keys were backlit.
115	;software	Acer was no help and Garmin could not determine the problem(after spending about 2 hours with me), so I returned it and purchased a Toshiba R700 that seems even nicer and I was able to load all of my software with no problem.
116	;volume;mouse	I wish the volume could be louder and the mouse didnt break after only a month.
117	;touchpad	I play a lot of casual games online, and the touchpad is very responsive.
118	;boots up	Granted, it's still a very new laptop but in comparison to my previous laptops and desktops, my Mac boots up noticeably quicker.
119	;hard drive	It caught a virus that completely wiped out my hard drive in a matter of hours.
120	;look and feel standpoint	It is everything I'd hoped it would be from a look and feel standpoint, but somehow a bit more sturdy.
121	;safari;safari;mozzilla firfox	the only fact i dont like about apples is they generally use safari and i dont use safari but after i install Mozzilla firfox i love every single bit about it.
122	;bluetooth;fingerprint reader driver;software	The Bluetooth was not there at all, and the fingerprint reader driver would be there, but the software would hang after installation was 1/2 way done.
123	;battery;speed;display	Great battery, speed, display.
124	;delivery	The delivery was fast, and I would not hesitate to purchase this laptop again.
125	;battery life;performance;memory	I've been impressed with the battery life and the performance for such a small amount of memory.
126	;applications;microsoft office	It's applications are terrific, including the replacements for Microsoft office.
127	;resolution;appearance;cooling system;graphics card	they improved nothing else such as Resolution, appearance, cooling system, graphics card, etc.
128	;built-in webcam;built-in mic;cam;mic	I got it back and my built-in webcam and built-in mic were shorting out anytime I touched the lid, (mind you this was my means of communication with my fiance who was deployed) but I suffered thru it and would constandly have to reset the computer to be able to use my cam and mic anytime they went out.
129	;windows vista	Is this partially due to the fact that it is running Windows Vista?
130	;board;connector;power supply;warrenty;power supply	  The board has a bad connector with the power supply and shortly after warrenty expires the power supply will start having issues.
131	;ethernet;works	My dad has one of the very first Toshibas ever made, yes its abit slow now but still works well and i hooked to my ethernet!
132	;drag and drop feature	Mostly I love the drag and drop feature.
133	;webcam	oh yeah, and if the fancy webcam breaks guess who you have to send it to to get it fixed?
134	;sales tax	I ordered through MacMall, which saved me the sales tax I would have incurred buying locally.
135	;software packages;iwork;garageband;imovie	Of course, I also have several great software packages that came for free including iWork, GarageBand, and iMovie.
136	;screen;colors;resolution	The screen is very large and crystal clear with amazing colors and resolution.
137	;monitor	After a little more than a year of owning my MacBook Pro, the monitor has completely died.
138	;itunes	The brand of iTunes has just become ingrained in our lexicon now, but keep in mind that Apple started it all.
139	;size;external monitor	Size: I know 13 is small (especially for a desktop replacement) but with an external monitor, who cares.
140	;base installation;software	Additional caveat: the base installation comes with some Toshiba-specific software that may or may not be to a user's liking.
141	;manuf	  Taking it back to Best Buy I found that a tiny plastic piece inside had broken (manuf issue).
142	;camera	It has no camera but, I can always buy and install one easy.
143	;display	The display is incredibly bright, much brighter than my PowerBook and very crisp.
144	;amd turin processor;intel	The AMD Turin processor seems to always perform so much better than Intel.
145	;warranty	  After that the said it was under warranty.
146	;start menu;navigate	The start menu is not the easiest thing to navigate due to the stacking.
147	;bluray read/write drive	Only thing I would want to add to this is an internal bluray read/write drive.
148	;service tech	The service tech said he had tried to duplicate the damage and wasn't able to recreate it therefore it had to be their defect.
149	;tech store	The tech store I purchased this from sent it back,,,,,eventually I got a new or repaired machine approximately 3 weeks later.
150	;surface	Really like the textured surface which shows no fingerprints.
151	;screen;keyboard	The screen is bright and the keyboard is nice;
152	;ilife;snow leopard x	But the machine is awesome and iLife is great and I love Snow Leopard X.
153	;price tag	High price tag, however.
154	;mac os	I thought learning the Mac OS would be hard, but it is easily picked up if you are familiar with a PC.
155	;sound output quality	"I had static in the output, and I had to reduce the sound output quality to ""FM"" as opposed to the default ""CD."
156	;techie	I custom ordered the machine from HP and could NOT understand the techie due to his accent.
157	;use	It is easy to use and lightweight.
158	;toshiba online help	I went to Toshiba online help and found some suggestions to fix it.
159	;service life	They also have a longer service life than other computers (I have several friends who still use the older Apple PowerBooks).
160	;ports;processor	If you check you will find the same notebook with the above missing ports and a dual core AMD or Intel processor.
161	;price;look	This laptop is a great price and has a sleek look.
162	;keyboard;keys	I especially like the keyboard which has chiclet type keys.
163	;screen	Small screen somewhat limiting but great for travel.
164	;quality	Runs Hot  I thought we were paying for quality in our decision to buy an Apple product.
165	;stock screen	For the not so good, I got the stock screen - which is VERY glossy.
166	;gray color	The gray color was a good choice.
167	;volume buttons	I would like to have volume buttons rather than the adjustment that is on the front.
168	;processor;computing	The processor a AMD Semprom at 2.1 ghz is a bummer it does not have the power for HD or heavy computing.
169	;protector;key pad	I bought a protector for my key pad and it works great :)
170	;magnetic plug-in power charging power cord	The magnetic plug-in power charging power cord is great (I even put it to the test by accident)- excellent innovation!
171	;xp;vista	It seems they could have updated XP and done without creating Vista.
172	;graphics;use	  It is easy to use, fast and has great graphics for the money.
173	;mac os;use	I like how the Mac OS is so simple and easy to use.
174	;support	While Apple's saving grace is the fact that they at least stand behind their products, and their support is great, it would be nice if their products were more reliable to justify the premium.
175	;geek squad	I was ready to take it back for a refund, but the Geek Squad camed through and pointed me in the right direction to get it fixed.
176	;graphics quality	only good thing is the graphics quality.
177	;appleworks;browser	The other lock-up problems are from a myriad of causes, the most common being a corrupted version of Appleworks which can render the browser useless.
178	;paint;keyboard	The paint wears off easily due to the keyboard being farther back than usual.
179	;service department	I had purchased it from a major electronics store and took it to their service department to find out what the problem was.
180	;warrenty;warrentys	The store honored their warrenty and made the comment that they don't even recommend the HP brand because of the problems with their warrentys.
181	;hard disk	I always use a backup hard disk to store important files at all times.
182	;cd drive;running	They sent out the box right away for me to send in my computer, they paid postage and whatnot, but when I got my computer back it still wasn't running right, and now my CD drive wasn't reading anything!
183	;screen size;web browsing	But the screen size is not that bad for email and web browsing.
184	;software;loads	Once I removed all the software the laptop loads in 15-20 seconds.
185	;trackpad;external mouse;trackpad	On my PowerBook G4 I would never use the trackpad I would use an external mouse because I didn't like the trackpad.
186	;games	This computer doesn't do that well with certain games it can't play some and it becomes too hot while playing games.
187	;features;human interface	"Obviously one of the most important features of any computer is the ""human interface."
188	;inbuilt applications;software	"Yeah, of course smarty pants ""fix it now"")Software - Compared to the early 2011 edition I did see inbuilt applications crashing and it prompted me to send the report to Apple (which I promptly did)."
189	;body	The body is a bit cheaply made so it will be interesting to see how long it holds up.
190	;i5	The i5 blows my desktop out of the water when it comes to rendering videos.
191	;antivirus software;firewall	With a mac you don't have to worry about antivirus software or firewall, it's so wonderful.
192	;price	Am very glad I bought it, great netbook, low price.
193	;apple team	The Apple team also assists you very nicely when choosing which computer is right for you :)
194	;vista;vista;operating system;vista	I think part of the problem with this computer is Vista, yet I know Vista isn't the entire issue because my latest purchase was my Acer and it also has Vista (I should have waited the few months to get the next operating system).
195	;video chat;quality	The video chat is the only thing that is iffy about it but im sure once they unpdate the next version on the macbook book the quality of it will be better.
196	;mouse	That whole experience was just ridiculous we sent it in and after they told us that we had to pay $175 to fix it we were like we will just by a portable mouse which would be way cheaper but they refused to send the laptop back until we paid the $175 and it was fixed.
197	;fan;cooling pad;feature	Fan vents to the side, so no cooling pad needed, great feature!
198	;software	i use my mac all the time, i love the software, the way it takes a short time to load things, how easy it is to use and most of all how you don't have to worry about viruses.
199	;installation time	Wasted me at least 8 hours of installation time.
200	;power;storage;abilitiy	It has far exceeded my expectations for power, storage, and abilitiy.
201	;spotlight search;feature	A great feature is the spotlight search: one can search for documents by simply typing a keyword, rather than parsing tens of file folders for a document.
202	;wireless system;windows 7	My wireless system would not recognize Windows 7 and I couldn't get online to find out why.
203	;quality	I am enjoying it and the quality it provides is great!
204	;battery life;speed	Suffice it to say, my MacBook Pro keeps me going with its long battery life and blazing speed.
205	;os;os	The OS is also very user friendly, even for those that switch from a PC, with a little practice you can take full advantage of this OS!
206	;itunes;program	iTunes is a handy music-management program, and it is essential for anyone with an iPod.
207	;gaming	Mac is not made for gaming.
208	;battery	Well I spilled something on it and they replaced it with this model, which gets hot and the battery doesn't make it through 1 DVD.
209	;apple support;techs	I've had to call Apple support to set up my new printer and have had wonderful experiences with helpful, english speaking (from Vancouver) techs that walked me through the processes to help me.
210	;adding the bluetooth	But Sony said we could send it back and be charged for adding the bluetooth an additional seventy something dollars.
211	;graphic power;adobe creative apps	I need graphic power to run my Adobe Creative apps efficiently.
212	;programs;use	the programs are esay to use and are quick to process this computer works like a charm.
213	;materials	The materials that came with the computer did not include the right # anywhere.
214	;software	It does not even have the software to play a dvd now.
215	;tech support;power supply	Tech support tells me the latter problem is a power supply problem and have offered to fix it if it happens again.
216	;power supply	HOW DOES THE POWER SUPPLY NOT WORK!!!
217	;size	Sells for the same as a netbook without sacrificing size.
