	aspect term	text
911	;expense	I know that everyone thinks Macs are overpriced and overrated, but once you get past the initial expense you'll find that they're worth every penny (besides, there's always the financing plan that Best Buy offers).
912	;cd drive	I am not going to sit here and complain about it not having a cd drive and what not because it is a netbook, it is made to be compact and if you want all the other stuff get a laptop.
913	;multi-touch trackpad	I love the multi-touch trackpad.
914	;extended warranties;cost	HP is more interested in selling extended warranties (which cost more than the netbook new) then they are in helping or fixing.
915	;software	"Not too much ""junk"" software to remove."
916	;performance;system	System is loosing about 20% of performance because of that.
917	;quality;price;use	It is easy to use, good quality and good price.
918	;apple keyboard;pc's keyboard	The difference in the Apple keyboard from a PC's keyboard took a bit of tim to get used to, but overall it's worth it!
919	;extended warranty	The extended warranty for the $4000 and up computers was the only one available for purchase on the drop drown menu.
920	;ram	Only issue is that it is a little slow, and I'm fixing that by adding more RAM.
921	;hard drive;power cord	  The hard drive crashed as well, and I had to buy a new  power cord.
922	;battery	Another issue I have with it is the battery.
923	;power supply;techies	After 2 months of complaints, Asus finally sent the right power supply to my techies.
924	;sony sonic stage software;speakers;subwoofer;extended life battery;docking port;bluetooth mouse;bluetooth enabled	That included the extra Sony Sonic Stage software, the speakers and the subwoofer I got (that WAS worth the money), the bluetooth mouse for my supposedly bluetooth enabled computer, the extended life battery and the Docking port.
925	;works	My MacBook Pro works like a dream, it has never overheated, or even been slightly warm for that matter.
926	;keynote;powerpoint program	PC users use the Powerpoint program for slide-show presentation and Mac users utilize Keynote.
927	;size;size	I get a ton of compliments on its size, and speaking as someone who regularly commutes on a bus, I can attest to the fact that this is the perfect size computer if you're restricted to the width of your body for computing room.
928	;browser	It takes me approximately 3 tries to get to each site, then after closing the browser and reopening it it actually works.
929	;carry	Easy to carry, can be taken anywhere, can be hooked up to printers,headsets.
930	;keyboard;keyboard	also the keyboard does not liht up so unless your sitting in a room with some light you cant see anything and thats bad for me because my boyfriend tends to watch tv in the dark at night which leaves me with no way of seeing the keyboard.
931	;programs;drivers	When I got my laptop back after this first instance it worked okay for a little bit then I started expeirencing issues again, everything from programs and drivers failing again, to it powering off for no reason, to locking up and freezing and just all sorts of issues.
932	;space	Love that it doesn't take up space like a regular computer.
933	;customer service rep	Asked the customer service rep.
934	;genius bar staff);fan;boot up	So, I took it back to the apple store and they narcissist genius bar staff) fixed it by resetting the fan at boot up.
935	;graphics;non-dedicated graphics card	Just keep in mind the graphics is not dedicated so loading the movie almost took a minute, but it ran fairly smooth for a non-dedicated graphics card.
936	;mouse cable;mouse	Needs Power and Mouse Cable to Plug in back instead of side, In the way of operating a mouse in small area.
937	;ram slots;hdd bays;16gb ram support;wireless	-4 RAM slots, 2 HDD Bays*, 16GB RAM support -No Wireless Issues, at least for me.
938	;asus tech support	I agree with the previous comment that ASUS TECH SUPPORT IS HORRIBLE WHICH IS A CON IN MY OPINION.
939	;screen;screen;display	In fact, somehow (and I never opened it up) some specks of dust or something got inside the screen and are now there permanently, behind the front of the screen, in the way of the display.
940	;mouse on the pad;left button	the mouse on the pad, the left button always sticks.
941	;batteries	  i have tried to charge on different batteries with no luck.
942	;battery life	I would recommend this computer to anyone searching for the perfect laptop, and the battery life is amazing.
943	;built in tools;itunes	We use the built in tools often, iTunes is open nearly every day and works great with my iPhone.
944	;size	the size of has actually help me out quite a bit by me being able to fit it in an already full backpack and to use it at a resturant where the food on the table is always so space consuming.
945	;quality;price	True quality at a great price!
946	;carry	Not easy to carry.
947	;programs;leopard running system	The programs that come standard with the Leopard running system are enough for the average person to run all the basics.
948	;lg service center;service center;service	"So what am I supposed to do?  The LG service center cannot provide me the ""service"" when it is called the ""service center""."
949	;material;specs;performs	The Material this Pro is made out of seems a lot nicer than any PC  Specs: Like I said this performs a lot better than any computer I've had in the past.
950	;price	"After doing extensive research, macconnection had the lowest price on the 15"" MBP i5."
951	;photo booth	I am ADDICTED to photo booth!
952	;operating system;user interface;multi-touch track pad	The operating system and user interface is very intuitive, and the large multi-touch track pad is amazing.
953	;hard disk;hard disk space;internal hard disk	Hard disk - The new editions gives you more hard disk space (500GB instead of 320GB) but time has taught me never to trust an internal hard disk.
954	;connects to wifi	It is extremely portable and easily connects to WIFI at the library and elsewhere.
955	;applications;windows	First things first, Macbook pro has many applications to make life easier, unlike the windows computers.
956	;screen;gaming	And the screen on this thing is absolutely amazing for high quality videos and movies and gaming.
957	;space	  I considered I may have too much on the computer, but after looking, there was plenty of space and that is not the issue.
958	;battery life	I don't use my laptop in a way though that needs a long battery life so it's perfect for me.
959	;charge	  i must keep it plugged in at all times because it will not keep a charge for longer than four minutes.
960	;power adapter	Summary: I've had this laptop for 2 months, out of the blue the power adapter stops working.
961	;price	I saw walmart had the same computer for about $650 but still knowing what I know now,I would not buy it at that price.
962	;weight	Of course, for a student, weight is always an issue.
963	;mainboard	Now mainboard is broken, have to wait for a new one.
964	;speed;hard drive;500gb external hard drive	The speed difference is next to NOTHING for a mac, and the hard drive can be manually upgraded or you could just buy a $60 500gb external hard drive.
965	;wireless card	2.The wireless card is low quality.
966	;operating systems	They also use two totally different operating systems.
967	;keys	They are about the same size keys.
968	;portability	I wasn't really as concerned about portability (it's a very large laptop) but it's not hard to move around or take on a trip which was a pleasant surprise.
969	;accessories	The people are frustrating to work with, the product itself is very cheaply made, and the accessories are less than satisfactory.
970	;warranty	They offer the best warranty in the business, and don't 3rd party it out like Toshiba.
971	;sound	The only problems are the sound isnt very loud I have to wear headphones.
972	;windows	Again- windows based machines were not giving me anything to work with!
973	;system	everything about a mac is wonderful, it takes a little used to learning and getting used to the new system, but you will learn fast and its all worth it.
974	;size;games	i love the size of the computer since i play games on it.
975	;playing games	You know, using the computer should be fun, not aggrevation, especially when you are playing games or working with photos.
976	;windows	There are no viruses or spyware to worry about like on a Windows computer.
977	;equipment	To be honest i think it was faulty equipment or something but idk.
978	;size	I also love the small, convenient size of my laptop, making it a perfect tool for my academic studies.
979	;build;wt;battery life	I love its solid build, light wt and excellent battery life (for now).
980	;quality	while about 8 years ago, I hope that the quality has changed.
981	;apple navigation;apps	The difference is it's a whole lot of fun using the laptop now, still learning the Apple navigation, but is fun and comes with a lot of cool apps.
982	;hard drives	-I propose that I can just swap the hard drives.
983	;battery;built;runs	The battery holds up well, it's built very solidly, and runs fast.
984	;sound card	Sound card is limited though.
985	;processing power;battery life;sized	This is a nicely sized laptop with lots of processing power and long battery life.
986	;vista	  The only thing I can imagine is that Sony jumped on early specifications for Vista requirements from Microsoft and designed it to those inadequate requirements.
987	;keyboard;desktop keyboard	The keyboard, which generally felt okay even for someone used to a desktop keyboard, now looks terrible.
988	;display	The display is awesome.
989	;mouse	The mouse is a little bit different than what you're used to though- it has one big flat panel and one full bar (instead of two separate ones) to click with- but you get used to it quite quickly.
990	;warranty	It took several weeks just to get them to acknowledge that I owned the warranty.
991	;keyboard;keyboard	The keyboard is like no other laptop keyboard.
992	;battery life	-Computer crashed frequently and battery life decreased very quickly.
993	;hard drives	-I propose that they can just swap the hard drives.
994	;driver;drivers/applications dvd	Every driver on the drivers/applications DVD is everything you will need for a reload.
995	;repair depot;repair depot	I called their repair depot as was told they would send Me a new box to return the computer to the repair depot.
996	;operating system	It's also fairly easy to use the Operating System.
997	;motherboards	I know that ASUS is known for making motherboards, but this is the worst computer experience that I have ever had.
998	;costing	We figure that after everything HIS pc actually ended up costing $350 more than my original Mac.
999	;ac plug	So having the AC plug go out on me and get lose or I could actually here it inside my computer on two of the three times is not good.
1000	;peformance;price	Peformance is good for the price.
1001	;shipping	The computer is currently in West Verginia doe to the method of shipping choosen by Toshiba.
1002	;bios	Summary: HP knew they were shipping out bad BIOS and did nothing proactive to resolve it.
1003	;ports	I had 3 months when the ports started going out.
1004	;o	The improvements to the OS have been relatively gradual, but substantive.
1005	;use	It is super easy to use.
1006	;hard drives	Many of my classmates computers hard drives crashed.
1007	;use	Ease of use is just one of the benefits I love about my Mac.
1008	;ms office	I wouldn't play a first-person shooter with this, mind, but if you wanted to run MS Office, email, chat, download a video, listen to music from a certain fruit-named music store, and were looking for a highly portable yet powerful netbook to do that all in, I'd highly recommend checking this out.
1009	;shipping;price;budget	"The 13"" Macbook Pro just fits in my budget and with free shipping and no tax to CA this is the best price we can get for a great product."
1010	;power;flexibility	The sheer power and flexibility makes the MacBook Pro a must have for any techie!
1011	;hdmi port;s-video port	The notebook is lacking a HDMI port and a S-video port that would enable one to hook it to a TV.
1012	;speakers	The speakers on it are useless too.
1013	;battery;surfing the web	Battery is lasting about 6 hours as I am surfing the web on Sundays while checking football scores and watching funny Youtube videos.
1014	;iphoto	Iphoto is great for adding pictures right to facebook and other social networking sites.
1015	;senior tech	"In early May I got it back and this time I only had it back for 1 day before it had a NEW issue so it was sent back in for the 6th time they ""expedited"" the repairs so I was only supposed to have to be without it for 3 days and it was supposed to be fixed, by a ""Senior Tech""."
1016	;volume wheel;sound quality;features	Some features arent friendly ( volume wheel, sound quality, etc.
1017	;price	"A cheaper price should not equal a ""cheap"" product."
1018	;manual;hard drive	I think the manual is somewhere on the hard drive, but I rather have a hard copy.
1019	;software	Thank you Best Buy for putting my computer together and installing my first software - you guys were GREAT too!
1020	;sensitivity	Adjust the sensitivity since it's not that responsive to begin with.
1021	;battery life;battery	After a couple of years, my battery life began to diminish but was replaced for free due to a company-wide recall of my particular battery.
1022	;battery life;case;core applications;system	The system constantly overheats, the battery life is too short, the case is coming apart, and my core applications that I use every day in my work as a graphic artist run poorly.
1023	;charge	  Later it held zero charge and its replacement worked for less than three months.
1024	;cord	  The company sent me a whole new cord overnight and apologized.
1025	;hook up to other wireless networks	It's even easy to hook up to other wireless networks.
1026	;shift key	  Also, I have had alot of trouble with the shift key to go to other lines.
1027	;rep	The rep did not even answer my question, I had to ask him, if he understood what I ask or if he spoke english because he didn't even try to acknowledge my question.
1028	;power;speed;programs	It gives me the power and speed that I need to run all the programs I use to edit.
1029	;ilife;microsoft office	iLife is easily compatible with Microsoft Office so you can send and receive files from a PC.
1030	;portability;longevity;use	As a computer science student in college, I find that the portability, longevity, and ease of use of this computer make me (shockingly) want to do homework more;
1031	;motherboard;fan	  Again I sent it back and they replaced the motherboard and some fan inside.
1032	;charged	Fully charged, the MacBook Pro can last about five hours unplugged.
1033	;price	Even though it is much more expensive than many PC laptops, it is worth the price.
1034	;price	I know there are way better laptops out there for the same price, and why spend money on shit when you can go out and get yourself a perfectly decent laptop that doesnt suck total monkey balls.
1035	;keys	For me, keys were starting to get stuck and wouldn't type very well.
1036	;standard os cd;proprietary hardware drivers	can't reinstall with standard os cd because of proprietary hardware drivers.
1037	;battery;charge	"There is a small red circle next to it with a x in the middle, and when I click on it it says: "" Consider replacing your battery"" and it does not hold full charge."
1038	;delivery	The computer was two weeks late in delivery because HP forgot to complete the required import paperwork.
1039	;programm	The first programm I switched on was a game for my children.
1040	;performance	I have been very pleased with the performance of this laptop.
1041	;battery life;response;internet focused activity	I bought it for my mom and she reports that the battery life lasts all day for her, it's very lightweight, and the response for the computing she's doing (Internet focused activity: mail, research, etc.) is excellent;
1042	;features	Its very nice and once you learn the features you will be so happy to have such a sophisticated computer.
1043	;charges	It is sleek and lightweight and charges quickly when needed.
1044	;size;look;feature;charge	also you may need to charge it once a day, if for medium use every thing fast and easy with mac  the size and look is the most feature that attracted me to it.
1045	;ibook backup;firewire connectio	( The iBook backup also uses a firewire connection).
1046	;camera;specifications	I did think it had a camera because that was one of my requirements, but forgot to check in the specifications on this one before I purchased.
1047	;display	Also the display is exceptional!
1048	;repair depot	The computer was shipped to their repair depot  on june 24 and returned on July 2 seems like a short turn around time except the computer was not repaired when it was returned.
1049	;keyboard shortcuts;shortcuts	Learning all of the keyboard shortcuts only took a few minutes to get used to as some of the shortcuts are the same on Windows machines.
1050	;ram	little short on RAM but you get what you pay for.
1051	;software;windows media;price	It didn't come with any software installed outside of windows media, but for the price, I was very pleased with the condition and the overall product.
1052	;warranty;replacement charger	THEN, one month after the warranty expired, the replacement charger went.
1053	;windows system	"I love a ""pc"" but I was ready for a change and tired of the windows system."
1054	;cursor;mousepad	Your cursor will end up all over the freaking place,,,it's not uncommon for me to accidentally delete words, sentences, paragraphs because of this mousepad.
1055	;features;printer software	Other installed features, such as certain printer software, are also most attractive.
1056	;power;memory;speed	I work in film editing and post production, so I need a laptop that not only has power, but memory and speed as well.
1057	;seventeen inch screen	It had a seventeen inch screen which I wanted, but I didn't realize at the time it would be such a monster!
1058	;hinge	Even doing so, the hinge may just be slightly tightened only.
1059	;shipping	company provides UPS shipping, fast, great!
1060	;technician	I would tell the technician I knew exactly what was wrong with it but they did not listen and I had to go through a bunch of junk to get them to tell me I needed to send the computer in.
1061	;dc jack;dc jack;power brick	  Then I've fixed the DC jack (inside the unit), rewired the DC jack to the OUTside of the laptop, replaced the power brick.
1062	;screen quality;use	It is easy to use, has great screen quality, and every so light weight.
1063	;graphics;use	Great product, very easy to use and great graphics.
1064	;ilife software;use	The iLife software that comes with the computer is so simple to use and produces a great finished product.
1065	;built-in webcam	The built-in webcam is great for Skype and similar video-chat services.
1066	;service center	The shop will definitely push the problem to the service center.
1067	;word;pages	PC users work in Word, while Mac users work in Pages.
1068	;applications;internet;gaming	While I mostly use it for email, internet and gaming, I'm confident all other applications live up to the high standard I've come to appreciate from Mac laptops.
1069	";17"" inch screen;price-point;appearance;boots up;runs"	"This laptop looks great on the surface: 17"" inch screen, good  price-point, nice appearance, boots up quickly, runs fast etc."
1070	;specifications;over priced	The apple systems are over priced luxurys that arn't worth what they are being charged for, this model's specifications are far from being impressive and they only thing you get out of this is the apple name.
1071	;battery life	pros:  the macbook pro notebook has a large battery life and you wont have to worry to charge your laptop every five hours or so.
1072	;screen;price	Disappointing for such a lovely screen and at a reasonable price
1073	;batteries	The only bad thing about it is they give you the worst batteries possible.
1074	;price	Good price.
1075	;motherboard	 THE MOTHERBOARD IS DEAD !
1076	;speed	the speed is fine.
1077	;retail price	Hmmm - that high failure rate sure isn't reflected in the retail price.
1078	;microsoft student edition	It was not clear that the Microsoft Student Edition that was loaded on the computer, was a six month trial.
1079	;web browsing;every day computing	Good for every day computing and web browsing.
1080	;functions	While lacking some of the functions of the other versions, this was very acceptable for the uses planned for this computer.
1081	;keys	  Also, I have had alot of trouble with the keys sticking and will not type correctly.
1082	;led monitor	Excellent LED monitor and well equipped.
1083	;mother board;hard drive	  This process continued to repeat itself until the mother board had been replaced 4 times and the hard drive replaced 3 times.
1084	;design	Without a doubt, the *design* of this laptop is fantastic.
1085	;battery;charge	I couldn't believe how long the battery lasted on a single charge.
1086	;memory	I could save ten essay papers and have hardly any memory left.
1087	;gaming	Other than that, I would recommend this to someone in need of a cheap laptop with semi-decent gaming capabilities.
1088	;screen size	This is the first time that I tried and owning a netbook although I have used 3 different laptops in the past 10 years, I find not much difference except of course for the screen size.
1089	;tech support	But the biggest pain is that tech support is not available 24/7.
1090	;backlit keys	The backlit keys are wonderful when you are working in the dark.
1091	;screen	I chose the iBookG4, a laptop that is an attractive computer with a large screen big enough to please anyone.
1092	;safari internet browser;firefox	The most recent being that my Safari internet browser is freaking out on me, but I have just been using firefox instead.
1093	;use	Everything about the Mac is not only visually appealing, but very easy to use.
1094	;battery	I know what 7 hrs of battery looks like.
1095	;support line	I did not have to call the support line at all.
1096	;windows 7 starter;windows 7	The laptop is outstanding in all aspects except that it has the Windows 7 starter and not the full Windows 7.
1097	;keyboard function	THE FIRST PROBLEM IS THAT THE KEYBOARD FUNCTION IS SIMPLY UNSATISFACTORY.
1098	;dvd drive	The DVD drive randomly pops open when it is in my backpack as well, which is annoying.
1099	;garageband;microphone	Garageband is more for the musicians, and the laptop is equipped with a good working microphone, good enough for beginners and musicians at the intermediate level.
1100	;linux;security-prone os;performs	I dual boot with Linux and that other security-prone OS and it performs flawlessly.
1101	;memory;hard drive space	The difference is the Toshiba had a lot more memory and hard drive space.
1102	;firewire cable system;ibook	There was a little difficulty doing the migration as the firewire cable system can't be used with the iBook.
1103	;shipment	Seems like maybe a bad shipment from Toshiba.
1104	;os x;quicklook	OS X is solid with lots of innovations such as quicklook which save heaps of time.
1105	;features	But other than that I am blown away by all the features this laptop offers.
1106	;keyboard	The keyboard is slick and quiet and not bulky like some other laptops I have had in the past.
1107	;design;colors	Overall, this laptop is definitely a keeper with its simple yet stylish design and its array of fantastic colors to choose from.
1108	;screen	First the screen goes completely out.
1109	;mousepad;browsing	I'm learning the finger options for the mousepad that allow for quicker browsing of web pages.
1110	;photobooth;program;built-in camera	The PhotoBooth is a great program, it takes very good pictures with the built-in camera.
1111	;software	Many kinds of software that is necessary to the working person is not available and cannot be downloaded.
1112	;shipping	I had to pay for the shipping!
1113	;chrome	It bluescreened on me without any warning, running simply basic Chrome.
1114	;prices	I took 3-4 years researching brands and prices of laptops.
1115	;price	We researched and found the best price at MacConnection.
1116	;external dvd drive;external drive	But guess what?  (you have to buy an external dvd drive it doesn't have a built in type) The notebook can't be used because it doesn't read anything for an external drive.
1117	;portability;processing	GET THIS COMPUTER FOR PORTABILITY AND FAST PROCESSING!!!
1118	;cooling pad	I use a cooling pad but it doesn't help.
1119	;supplied software;software;windows	Supplied software: The software that comes with this machine is greatly welcomed compared to what Windows comes with.
1120	;service	I'm tired of the inept service.
1121	;garageband;apple applications	Garageband is easy to work with, like all the other apple applications I've had experience with.
1122	;bios;bios	"No, tey don't even support their own bios and it ""could be a problem with the bios"" How can a company that makes a fairly decent product get away with such insanity??!!"
1123	;extended warranty	Because we did not purchase the extended warranty in time, we are on the hook for the repair.
1124	;charging;charge;charge	"It started out by randomly ceasing to charge when it was plugged in (mousing over the battery icon would read, for example, ""74%, plugged in, not charging""), requiring me to unplug it and plug it back in several times to get it to charge."
1125	;shipped	This laptop looked brand new and was shipped very quickly.
1126	;windows;kernal	Info: Windows failed to load because the kernal is missing, or corrupt.
