	aspect term	text
451	;programs;navigation	It didn't take me long to get switched over to the Mac computer programs and navigation - it's been just fine and like the way this laptop functions much better.
452	;hinge;lcd	However, my girlfriend realized that the netbook's hinge is a bit loose (when you open or close the LCD).
453	;dell customer service	My problem was with DELL Customer Service.
454	;rma service	Newegg's RMA service was great as always, I contacted them late Friday night, and they issued me an RMA number and a PrePaid UPS shipping label the very next morning on Saturday.
455	;design	Design: very durable.
456	;keyboard	It is easy to go from one keyboard to another.
457	;battery life	Has a 5-6 hour battery life.
458	;screen/video resolution;resolution	My ONLY issues are: 1) the screen/video resolution won't increase to a higher resolution then 1024 x 60
459	;applications;dreamweaver;final cut pro 7;photoshop;safari;firefox;msn messenger	I run Dreamweaver, Final Cut Pro 7, Photoshop, Safari, Firefox, MSN Messenger and a few other applications constantly at the same time.
460	;warrenty	  I was told by many  that it was a great computer, but we got one of these, and it worked  great for one year, and as soon as the warrenty was up, then it got  really bad.
461	;tech support	Ive had to call tech support many times.
462	;apple applications;iphoto	The Apple applications (ex.iPhoto) are fun, easy, and really cool to use (unlike the competition)!
463	;gigs	Not to mention it has shit gigs.
464	;memory;17-inch screen;dvd;cd burners	I paid for extra memory and the 17-inch screen, as well as the top of the line DVD and CD burners.
465	;web browsing;uploading photos;watching movies;creating presentations	Its pretty fast and does not have hiccups while I am using it for web browsing, uploading photos, watching movies (720p) on occasion and creating presentations.
466	;quality display	Quality Display  I love HP,, it's the only computer/printer we will buy.
467	;weight;12 cell battery	Despite the inconvenient weight, I opted for the 12 cell battery.
468	;case	The case is carved out of a single block of aluminum.
469	;power adapter plug	     First it burned or fused the power adapter plug.
470	;features;speakers	the features are great, the only thing it needs is better speakers.
471	;screen	It was still working, but there was nothing on the screen.
472	;tab	I bought this laptop and found its TAB is not functioning.
473	;extended warrenty	  Toshiba is aware of the issue but unless the extended warrenty is bought Toshiba will do nothing about it.
474	;tft panel	-Called headquarters again, they report that TFT panel is broken, should be fixed by the end of the week (week 3).
475	;navigation;windows operating systems	Navigation through the computer is far superior compared to Windows operating systems, as well.
476	;screen;screen size;bulk	The screen is framed by half- to a full-inch margin that is obviously unnecessary, reduces the screen size and increases the bulk.
477	;music software;software;picture;video	Though the picture, video, and music software is nowhere close to professional grade software Im used to (CS5) but does the job for beginner and even intermediate media designers.
478	;combined touch pad and clicker	The much lauded combined touch pad and clicker is a nightmare.
479	;unibody construction	The Unibody construction is solid, sleek and beautiful.
480	;value	This MacBook is an outstanding product with great value.
481	;windows;screen hinges	I had to re-install Windows within two weeks of the purchase and soon discovered cracks in the screen hinges.
482	;battery;storage life;service	A SECOND PROBLEM INVOLVES THE BATTERY WHICH IS ADVERTISED AS HAVING A STORAGE LIFE OF 11 HOURS BUT WHEN FULLY CHARGED SHOWS ONLY 7 HOURS OF SERVICE.
483	;storage;ram	and plenty of storage with 250 gb(though I will upgrade this and the ram..)
484	;nvidia chipset	"No temporary replacement, they are out of replacements because ""many computers had problems with the Nvidia chipset""-Inquired status of repair."
485	;extended warranty	I took it to friend who temporarily fixed it and I finally paid about 1500 for the extended warranty.
486	;programs	Programs would crash all the time, and it turned out to be a very unstable, unreliable laptop for me.
487	;charge time	I BOUGHT THIS LAP TOP AND THE CHARGE TIME DOSEN'T LAST AS LONG AS THEY SAY IT WILL MORE LIKE 2 HOURS
488	;size;consistancy	Also, because of the size and consistancy of the laptop computer, some websites wouldn't even attempt to work on the computer because of browser problems.
489	;key bindings	the key bindings take a little getting used to, but have loved the Macbook Pro.
490	;keyboard;size	Keyboard is reasonable size.
491	;10-key	I find myself using the 10-key more than I thought I would.
492	;fan;fan	Fan noise: The fan made a constant hissing noise in the background.
493	;screen;operating system	The screen is bright and clear, the operating system is solid and friendly to a novice.
494	;processor;500gb hard drive	It has a .1 ghz faster processor and a stock 500gb hard drive.
495	;feature	The feature are good enough for what I need.
496	;tech support	Finally, the biggest problem has been tech support.
497	;usb output	""" This isn't a big deal, I haven't noticed the issue with DVDs or other media, only through USB output."
498	;wireless mouse	With Windows laptops a wireless mouse is an absolute must.
499	;size;screen;windows;linux	(I had been a Windows/Linux user before this) I love the size because the screen is big enough for what I use it for (Internet, artwork), and yet it is small enough to be reasonably portable.
500	;windows disc	But if you're willing to pay another 200 dollar for a windows disc.
501	;quality	Very good quality and well made.
502	;touchpad	I bought a Logitech desktop set in anticipation for using with the MBP, but I use the touchpad 90% of the time.
503	;video card	my niece and nephew have played a few web games and it runs anything that doesn't require a dedicated video card.
504	;touch pad	It had the full sized touch pad with 2 buttons instead of just one.
505	;external mouse	Typically, when I purchase a new laptop I always end up using an external mouse for convenience.
506	;set up	It was super easy to set up and Is really easy to get used to.
507	;video	The only thing that can be updated is the video, other than that you're all set.
508	;value	Its a good laptop for its value.
509	;hard drive	Then the hard drive failed;
510	;runs;loads	Plain and simple, it(laptop) runs great and loads fast.
511	;warranty	of course my warranty runs out next month.
512	;program	The capabilities using that program alone made me want a Mac.
513	;disk throughput;spinning beachball	"(If you ever see the spinning beachball come up when you think it shouldn't, check the ""Activity Monitor"" app to see if the disk throughput has temporarily dropped to zero."
514	;wireless internet access	I have found also, it is very easy to be able to access wireless internet access;
515	;value	This is a great value for the money.
516	;ran	It was a great laptop, ran great and was really fast.
517	;battery	The battery has never worked well.
518	;company	I will never buy another computer from Dell ever again do to how awful it worked and how I was treated by the company.
519	;screen resolutions	The only problem is a lack of screen resolutions!
520	;carry	Small enough to use on a long flight, Light enough to carry through airports and powerful enough to replace my desktop while on long business trips.
521	;keyboard;edges	Typing on the keyboard becomes uncomfortable after extended use due to the sharp edges that your wrists rest on.
522	;programs;ilife;iphotos	It has many great programs, such as ILife, iPhotos and others.
523	;processor;fan;motherboard	The processor went on me, the fan went and the motherboard went.
524	;built	It is very well built.
525	;performance	I highly recommend this laptop to anybody that wants great performance from a laptop and would like to relax and not become enraged cursing the gods about to throw your laptop out the door.
526	;screen resolution	The screen resolution was exactly what I was looking for.
527	;snow leopard;cpu;office mac applications;word;excel;spinning wheel	Even though it is running Snow Leopard, 2.4 GHz C2D is a bit of an antiquated CPU and thus the occasional spinning wheel would appear when running Office Mac applications such as Word or Excel.
528	;pad;keyboard	There is no number pad to the right of the keyboard which is a bummer.
529	;screen	After 20-30 min the screen of the notebook switched off.
530	;windows 7	If upgrade is possible to the full Windows 7, then I will truly be a very happy geek.
531	;programs;ilife;iwork	I was originally concerned that I couldn't view work I had done in college on my Mac because of the PC formatting, but I was even more thrilled to learn of programs like iLife and iWork that allow you to convert your PC documents into readable files on Macs.
532	";18.4"" screen"	"It is a big big, but since it has a 18.4"" screen what would you expect!"
533	;battery life	10 hours of battery life is really something else....
534	;regular layout keyboard;runs	Runs fast and the regular layout keyboard is so much better.
535	;programs	All the programs are easy and straight forward on my MacBook Pro, it is clean and organized, which I always strive to be myself.
536	;windows;recovery discs	I reinstalled windows through the recovery discs and everything seemed good again.
537	;windows 7 starter	Windows 7 Starter is terrific (no you can't change the background) but I don't need to, I use it just for school work.
538	;support	Support has been lackluster and now I just want a refund.
539	;warranty;online chat service	First of all, they had no record of me having the 3 year warranty I'd paid almost $400 for, and I had to call in, spend hours on their online chat service, and fax in multiple documents.
540	;iphoto	""">  iPhoto is probably the best program I have ever worked with: easy and convenient."
541	;works	I love to write and play with graphics and html programming and my new Toshiba works great on both!
542	;battery	My laptop now has no battery.
543	;quality;vhs	Beta had better quality, but VHS became the industry standard.
544	;use;navigate	It made the computer much easier to use and navigate.
545	;battery life	:-)If you buy this - don't go into it expecting 7 hrs of battery life, and you'll be perfectly satisfied.
546	;battery	Needs longer lasting battery, More than 1 to 2 Hrs.
547	;usb ports	in May I started having problems with the USB ports not working.
548	;battery	10 plus hours of battery...
549	;design;quality	The design is awesome, quality is unprecedented.
550	;mac version of microsoft office	The Mac version of Microsoft Office is cheaper than buying the actual and works just as well.
551	;starting-up time	The Mac takes about the same amount of starting-up time as the average PC, but keeps itself cleaned up and ready to use.
552	;operates	The Toshiba Net book operates very well.
553	;touch pad;touch pad	the touch pad is fine - again, it's a real touch pad.
554	;pictures	The pictures are clear as can be.
555	;transporting	It is also very lightweight, making transporting this computer very easy.
556	;gaming	It's wonderful for computer gaming.
557	;network capability;wifi card	You have to toss out the wifi card and replace it just to have any sort of network capability.
558	;printer	AND the best part is that it even comes with a free printer (when they have a certain promotion/offer going, of course)!
559	;use	it is very easy for anyone to use an apple and specially the mcbook pro notebook.
560	;os x	The flaws are, this computer is not for computer gamers because of the OS X.
561	;repair service	They really do have the worlds very worst repair service.
562	;customer service agents	They need to stop outsoucing and send some complaint calls to US based customer service agents for those who live in the United states.
563	;photoshop;aftereffects programs	  I was also able to install and use my Photoshop and AfterEffects programs easily.
564	;runs	It's perfect for everything and runs faster than an average pc!
565	;warrenty	 Then after paying for it to be examined I was told it was same problem cited on website but I'd have to pay anyways since it was past warrenty.
566	;look;dependability	I'm already hooked on the sleek look and dependability that this laptop has shown.
567	;company	And having to deal with the company has been a even worse nightmare.
568	;warranty	  I will definitely be getting a new laptop if it has any more issues after the warranty expires and researching carefully when I do so I don't run accross a situation like this again!
569	;features	It has all the features that are necessary for college and if not they are able to be added onto the computer.
570	;mouse button	I've owned this labtop for less then two months, already the mouse button has broke.
571	;performance	It did fairly well, other than it's poor performance, overheating and occational blue screen.
572	;touchpad;buttons	The touchpad is very intuitive, so much so that I never want to use buttons to click again!
573	;programs	tons of bloatware and junk programs.
574	;space;keyboard	lots of extra space but the keyboard is ridiculously small.
575	;battery	It's so bad that I'm thinking I only got half a battery or something.
576	;keyboard;battery life;hard drive;windows 7	Good keyboard, long battery life, largest hard drive and windows 7.
577	;processor;applications;load;webpages	The processor is very quick and effective as I load webpages and applications.
578	;battery	My battery went bad about a year and a half after having it and it cost around eighty to a hundred dollars!
579	;boot	It pretty much does everything we could ever need, and looks great to boot.
580	;windows	As a lifelong Windows user, I was extremely pleased to make the change to Mac.
581	;runs	The Macbook is also made better, my computer has never got a virus, and the laptop runs just as fast as the first day I bought it.
582	;openoffice;firefox;price	I wiped nearly everything off of it, installed OpenOffice and Firefox, and I am operating an incredibly efficient and useful machine for a great price.
583	;quality;performance;battery life	Overall I feel this netbook was poor quality, had poor performance, although it did have great battery life when it did work.
584	;use	I picked it out because it was inexpensive ($400) and I thought it would be a good, easy to use first laptop.
585	;product key	MY ONLY PROBLEM IS I CAN NOT REG. THE PRODUCT KEY.
586	;specs	Pay attention to the specs if you want these options.
587	;bluetooth	It also does not have bluetooth.
588	;feature;one touch keys	Sure it has the one touch keys but that was the best feature of the computer.
589	;battery life	great battery life.
590	;keyboard;speed	The real stand out on this computer is the feel of the keyboard and it's speed.
591	;specs;price	At first, the computer seemed a great deal--seemingly high-end specs for a low, low price.
592	;delivery	Delivery was early too.
593	;stability;mac software;operating system	Love the stability of the Mac software and operating system.
594	;sata controller	And that probably explains why I've already had my SATA controller go bad within a year of buying it.
595	;video editing;performance;mobile video editing	It's also very capable of doing moderate video editing (although you may need the performance boost of the larger MacBook Pros for heavy duty mobile video editing).
596	;imovie program	My main reason to convert was the imovie program.
597	;processor;ram	It has a faster processor and more ram.
598	;battery	Laptops are usually used on the go, so why not give you a better battery?
599	;price	I will never complain about the price since I believe you get what you pay for and my MacBook Pro was worth every dollar.
600	;designed	I wasn't a big fan of the Netbooks but this one was very well designed.
601	;warranty	And the warranty on this macbook pro can last up to 5 years or 1000 battery recharge cycles.
602	;bluetooth mouse	I still have that stupid bluetooth mouse to!
603	;features	Would like more trendy, high tech features.
604	;keyboard;control buttons	Keyboard is great but primary and secondary control buttons could be more durable.
605	;screen	Screen is a bit glossy, but that's not too bad.
606	;motherboard;motherboard	I got it back again and was told the motherboard had been replaced, so I was now on the SECOND motherboard within 3 months.
607	;processor;performance	Processor - When compared to my 3 week old Early 2011 edition there I barely experience any difference in performance (2.3 GHz v/s 2.4 GHz).
608	;motherboard	They say it could be the motherboard again, but Dell
609	;patches	2nd Best computer in the world  only one way this computer might become the best is that it needs to upgreade patches  to make less easier for people to hack into
610	;speed	Love the speed, especially!
611	;system memory;radeon 5850;ddr5;ddr3	It could be a perfect laptop if it would have faster system memory and its radeon 5850 would have DDR5 instead of DDR3.
612	;programs;programs	Not only are the versions of these programs able to be saved, worked on and opened on both a PC and Mac, the versions of these programs on a Mac are graphically and functionally superior.
613	;speed	The speed gives you the power to work on these projects seamlessly, and multiple at a time if you sowish.
614	;size	Awesome laptop and the perfect size to carry around in college.
615	;os (vista)	 A MONTH LATER, we reinstall the OS (Vista).
616	;software	Some problems can be fixed if you purchase new software, but there is no guarentee.
617	;battery life	My real problem with it? The statement of 7 hour battery life is not just mere exaggeration -- it's a lie.
618	;battery life	The battery life is also relatively good.
619	;extended warranty	  I definitely suggest getting an extended warranty, you will probably need it!
620	;features;programs;use	I have found it very easy to use, very imformative, wonder alerts and tutorials making it very easy for someone like me who is not exactly technologically advanced to learn to use the various features and programs.
621	;pop up windows;web programming software;pop ups	I don't have stupid pop up windows (even when I have pop ups blocked), I don't have to wait 5 minutes for a webpage to download, and best of all I can run all the web programming software I need to use all at once without slowing me down.
622	;memory	Memory is upgradable.
623	;3g network;web access	Web access through the 3G network is so slow, it's very frustrating and VERY DISAPPOINTING.
624	;screen;design based programs;adobe creative suite	The large screen also helps when you are working in design based programs like Adobe Creative Suite.
625	;companies	Moral of the story:-Do not buy anything from companies that do not respect their customers.
626	;customer service	This is my first Dell I heard their customer service was lacking and that they were working on improving it!
627	;plug	As well as having the plug in the computer come loose.
628	;hdd cover	Second HDD cover has walls inside that need to be broken if you what to install one.
629	;applications	If you want more information on macs I suggest going to apple.com and heading towards the macbook page for more information on the applications.
630	;design	Great product by Apple with the new great looking design.
631	;keyboard	I love the keyboard.
632	;iphoto;program	I use iphoto all the time, which is a great program for anyone who is into photography - amateurs and experts alike.
633	;screen	The screen isn't huge, but that doesn't matter when I output media to the 50 inch LCD TV.
634	;spy ware;nortell	I will have to purchase Spy ware or Nortell for privacy protection.
635	;videocard	I was said it's videocard.
636	;price	For the price and what I get out of it has exceeded my expectations.
637	;drivers	If your time is worth anything to you, if you are tired of rebooting, reformatting, reinstalling, trying to find drivers, if you want a computer to work for you for a change, make the change to this computer.
638	;speakers;keyboard	The only thing I wish is the 15 inch MacBook Pro has much better speakers on the side of the keyboard.
639	;use	  Now, as easy as it is to use, and I do think it is a great STARTER laptop.
640	;setting;screen size;pixel sizes	Setting would change for some reason, the screen size would change on it's own, like the pixel sizes and whatnot.
641	;pre installed software update	It had some kind of pre installed software update that completely shut the computer down when you clicked it.
642	;customer services;toshiba customer services	Ever since I bought this laptop, so far I've experience nothing but constant break downs of the laptop and bad customer services I received over the phone with toshiba customer services hotlines.
643	;space bar	Also, the space bar makes a noisy click every time you use it.
644	;iphotos;program	iPhotos is an excellent program for storing and organizing photos.
645	;performing	Other than that its a great performing machine and well meets all my needs and more.
646	;software;software;booting	"Called tech support and got the usual Acer ""We don't support software but for $$$ we can help you"" I explained there was no software involved in booting."
647	;programs;iphoto;imail;imovie	The programs are great, like iphoto (love the editing capabilities), imail (which can incorporate with the address book on the ipod and ipad), imovie, etc.
648	;software	The only thing I didn't learn in my research was the software I would need like privacy protection and warranty protection, in case it gets broken, or crashes etc.
649	;use;transport	Comfterbale to use light easy to transport.
650	;repair depot	The Computer itself is a good product but the repair depot stinks.
651	;price;specs	I thought the price was great for the specs.
652	;cd drive	the only down fall is that it has no cd drive but i found that they are very cheap to by and also very portable making this the best friend to someone who is always looking for more space then they have.
653	;hard disk capacity	So, the hard disk capacity really doesn't matter to me.
654	;keys	Keys stick periodically and I havent had the laptop for 45 days yet.
655	;trackpad	I also like that you can scroll down in a window using two fingers on the trackpad.
656	;design;os	Everything from the design to the OS is simple and to the point.
657	;shipping	I'v spent as much for shipping as I would to buy a new netbook -- of course a different brand.
658	;gaming look;gaming performance	I personally like the gaming look but needed a machine that delivered gaming performance while still looking professional in front of my customers.
659	;hard drive	This just keeps having it's hard drive replaced!
660	;cost	When you look at the specs on Apple products in comparison to a Dell or a HP, yes they do seem to offer less for a higher cost.
661	;volume control	The only downfall is the volume control.
662	;boot up;shut down	Very fast boot up and shut down.
663	;price	I finally decided on this laptop because it was the right price for what I need it.
664	;internet connectivity;usb wireless card	If internet connectivity is important I would recommend going with a dell net book for 50 bucks more, or buy a USB wireless card.
665	;sound	I had read online that some users were having sound problems.
666	;cost	My last computer, a Toshiba, cost only $400, and worked like a charm for many years.
667	;discharges	It discharges too quickly.
668	;compatibility	But to be honest, the compatibility issues and the other little quirks make me think I ll buy a PC next time.
669	;charging	Then it ceased charging at all.
670	;stand;design;heat sink	I do not experience a lot of heat coming out of it, however I would highly suggest purchasing a stand however, due to the nature of the design of the macbook as it is one very large heat sink.
671	;webcam	*=Webcam is a bit laggy, not the greatest.
672	;trend micro;antiviral program	I am not much of a computer techie, so I can understand some of the internal problems, though I do have trend micro as an antiviral program.
673	;warrenty	The computer continued to give me issues and in Late June it completely died again and I tried to call Acer again to get it fixed and they refused to help me, they said my warrenty was up and hung up on me.
674	;plastic piece;usb port wires	I've haven't had any major problems with the laptop except that the plastic piece that covers the usb port wires have all come off.
675	;case design	Wonderful sleek case design is only on the outside.
676	;connection	It is speedy when connected wirelessly to any network regardless if the connection is weak or not.
677	;pricing	The pricing is very competitive.
678	;built-in wireless	Connecting to my wireless router via built-in wireless took no time at all.
679	;screen size;processing power	This computer is exceptionally thin for it's screen size and processing power.
680	;applications	I have not had a problem with the applications quitting or freezing.
681	;screen	Maybe this is virus related, maybe not, but the computer has locked up many times, and on two occasions, the screen has simply gone black.
682	;programs	This wiped out several programs that were installed on the computer when it was bought.
683	;graphics;graphics	It's graphics aren't bad at all, for the lower end of the MacBook Pro spectrum, easily capable of running StarCraft II and other games with comparable graphics.
684	;vista;programs;install;uninstall 	I have Vista, so I am unable to install and uninstall  some programs.
685	;screen;keyboard	The screen is bright and vivid and the keyboard is very easy to use, very important for use quick typers.
686	;mouse	the mouse jumps around all the time and it clicks stuff i dont want it too.
